Date,Song Title,Artist,Album,Duration
2025-03-29,Handlebars,JENNIE,JENNIE,3:04
2025-03-29,intro (end of the world) [extended],Ariana Grande,Ariana Grande,2:41
2025-03-29,รักแรกพบ (Knock Knock) [From ซองแดงแต่งผี],Billkin,Billkin,2:37
2025-03-29,บทสรุปสุดท้าย,Z9,Z9,4:24
2025-03-29,like JENNIE,JENNIE,JENNIE,2:03
2025-03-29,Nakorn Dara,YOUNGOHM,YOUNGOHM,3:16
2025-03-29,ตีหนึ่งที่คูเมือง,ILLSLICK,ILLSLICK,3:24
2025-03-29,กุหลาบ (feat. ก้านตอง ทุ่งเงิน & Saran),F.HERO,F.HERO,3:55
2025-03-29,CURSE (รักใครไม่เป็น) [feat. 2K & Saran],Z9,Z9,4:13
2025-03-29,twilight zone,Ariana Grande,Ariana Grande,3:18
2025-03-29,luther,Kendrick Lamar,Kendrick Lamar,2:57
2025-03-29,เพลงรัก,Three Man Down,Three Man Down,4:29
2025-03-29,See You Somewhere (From ซองแดงแต่งผี),Billkin,Billkin,3:39
2025-03-29,สักวันฉันจะหายดี,Ink Waruntorn,Ink Waruntorn,3:48
2025-03-29,Born Again (feat. Doja Cat & RAYE),LISA,LISA,3:51
2025-03-29,BIRDS OF A FEATHER,Billie Eilish,Billie Eilish,3:30
2025-03-29,intro (end of the world),Ariana Grande,Ariana Grande,1:32
2025-03-29,อยู่ได้แล้ว (feat. Mirrr),Lipta,Lipta,4:13
2025-03-29,Die With A Smile,Lady Gaga,Lady Gaga,4:11
2025-03-29,ExtraL,JENNIE,JENNIE,2:47
2025-03-29,ล้มแชมป์ (Only You Can),Tilly Birds,Tilly Birds,3:28
2025-03-29,สัมภเวซี้ (GFF Ghost Friend Forever) [From ซองแดงแต่งผี],Billkin,Billkin,3:22
2025-03-29,APT.,ROSÉ,ROSÉ,2:49
2025-03-29,Anxiety,Doechii,Doechii,4:09
2025-03-29,Yours Ever (feat. Q Flure),Cocktail,Cocktail,4:19
